Article,Topic
"An electric car is a car that is propelled by one or more electric motors, using energy stored in rechargeable batteries. Compared to internal combustion engine (ICE) vehicles, electric cars are quieter, have no exhaust emissions, and lower emissions overall. In the United States, as of 2020, the total cost of ownership of recent EVs is cheaper than that of equivalent ICE cars, due to lower fueling and maintenance costs. Charging an electric car can be done at a variety of charging stations; these charging stations can be installed in both houses and public areas.",Electric Car
"Several countries have established government incentives for plug-in electric vehicles, tax credits, subsidies, and other non-monetary incentives. Several countries have established a phase-out of fossil fuel vehicles, and California, which is one of the largest vehicle markets, has an executive order to ban sales of new gasoline powered vehicles by 2035.",Electric Aircraft
"The Tesla Model 3, which has a maximum range of 570km (353 miles) according to the EPA, has been the world's best-selling electric vehicle (EV) on an annual basis since 2018, and became the world's all-time best-selling electric car in early 2020. Earlier models with widespread adoption include the Japanese Mitsubishi i-MiEV and the Nissan Leaf.",Electric Car
"As of December 2019, the global stock of pure electric passenger cars totaled 4.8 million units, representing two-thirds of all plug-in passenger cars in use. In 2019, over half (54%) of the worlds all-electric car fleet was in China. Despite rapid growth, the global stock of fully electric and plug-in hybrid cars represented about 1 out of every 200 vehicles (0.48%) on the world's roads by the end of 2019, of which pure electrics comprised 0.32%. By the end of 2020 there were more than 10 million electric cars sold, an increase of 41% from prior year, according to an International Energy Agency report.",Electric Car
"Electric cars are a type of electric vehicle (EV). The term ""electric vehicle"" refers to any vehicle that uses electric motors for propulsion, while ""electric car"" generally refers to highway-capable automobiles. Low-speed electric vehicles, classified as Neighborhood Electric Vehicles (NEVs) in the United States, and as electric motorised quadricycles in Europe, are plug-in electric-powered microcars or city cars with limitations in terms of weight, power and maximum speed that are allowed to travel on public roads and city streets up to a certain posted speed limit, which varies by country.",Electric Aircraft
"While an electric car's power source is not explicitly an on-board battery, electric cars with motors powered by other energy sources are typically referred to by a different name. An electric car using solar panels as a power source is a solar car, and an electric car powered by a gasoline generator is a form of hybrid car. Thus, an electric car that derives its power from an on-board battery pack is a form of battery electric vehicle (BEV). Most often, the term ""electric car"" is used to refer to battery electric vehicles, but may also refer to plug-in hybrid electric vehicles (PHEV).",Electric Aircraft
"The first practical electric cars were produced in the 1880s. In November 1881, Gustave Trouv presented an electric car at the Exposition internationale d'lectricit de Paris. In 1884, over 20 years before the Ford Model T, Thomas Parker built a practical production electric car in Wolverhampton using his own specially designed high-capacity rechargeable batteries, although the only documentation is a photograph from 1895 (see below). The Flocken Elektrowagen of 1888 was designed by German inventor Andreas Flocken and is regarded as the first real electric car.",Electric Car
"Electric cars were among the preferred methods for automobile propulsion in the late 19th and early 20th century, providing a level of comfort and ease of operation that could not be achieved by the gasoline cars of the time. The electric vehicle stock peaked at approximately 30,000 vehicles at the turn of the 20th century.",Electric Car
"In 1897, electric cars found their first commercial use as taxis in Britain and the US. In London, Walter Bersey's electric cabs were the first self-propelled vehicles for hire at a time when cabs were horse-drawn. In New York City, a fleet of twelve hansom cabs and one brougham, based on the design of the Electrobat II, were part of a project funded in part by the Electric Storage Battery Company of Philadelphia. During the 20th century, the main manufacturers of electric vehicles in the US were Anthony Electric, Baker, Columbia, Anderson, Edison, Riker, Milburn, Bailey Electric, Detroit Electric and others. Unlike gasoline-powered vehicles, the electric ones were less noisy, and did not require gear changes.",Electric Aircraft
"Six electric cars held the land speed record in the 19th century. The last of them was the rocket-shaped La Jamais Contente, driven by Camille Jenatzy, which broke the 100km/h (62mph) speed barrier by reaching a top speed of 105.88km/h (65.79mph) on 29 April 1899.",Electric Car
"Electric cars were popular until advances in internal combustion engine (ICE) cars (electric starters in particular) and mass production of cheaper petrol (gasoline) and diesel vehicles led to a decline. ICE cars' much quicker refueling times and cheaper production costs made them more popular. However, a decisive moment was the introduction in 1912 of the electric starter motor that replaced other, often laborious, methods of starting the ICE, such as hand-cranking.",Electric Car
"The emergence of metaloxidesemiconductor (MOS) technology led to the development of modern electric road vehicles. The MOSFET (MOS field-effect transistor, or MOS transistor), invented by Mohamed M. Atalla and Dawon Kahng at Bell Labs in 1959, led to the development of the power MOSFET by Hitachi in 1969, and the single-chip microprocessor by Federico Faggin, Marcian Hoff, Masatoshi Shima and Stanley Mazor at Intel in 1971. The power MOSFET and the microcontroller, a type of single-chip microprocessor, led to significant advances in electric automobile technology. MOSFET power converters allowed operation at much higher switching frequencies, made it easier to drive, reduced power losses, and significantly reduced prices, while single-chip microcontrollers could manage all aspects of the drive control and had the capacity for battery management. Another important technology that enabled modern highway-capable electric cars is the lithium-ion battery, invented by John Goodenough, Rachid Yazami and Akira Yoshino in the 1980s, which was responsible for the development of electric cars capable of long-distance travel.",Electric Aircraft
"In the early 1990s, the California Air Resources Board (CARB) began a push for more fuel-efficient, lower-emissions vehicles, with the ultimate goal being a move to zero-emissions vehicles such as electric vehicles. In response, automakers developed electric models, including the Chrysler TEVan, Ford Ranger EV pickup truck, GM EV1, and S10 EV pickup, Honda EV Plus hatchback, Nissan Altra EV miniwagon, and Toyota RAV4 EV. Both US Electricar and Solectria produced 3-phase AC Geo-bodied electric cars with the support of GM, Hughes, and Delco. These early cars were eventually withdrawn from the U.S. market.",Electric Car
"California electric automaker Tesla Motors began development in 2004 of what would become the Tesla Roadster, which was first delivered to customers in 2008. The Roadster was the first highway legal all-electric car to use lithium-ion battery cells, and the first production all-electric car to travel more than 320km (200 miles) per charge. The Mitsubishi i-MiEV, launched in 2009 in Japan, was the first highway legal series production electric car, and also the first all-electric car to sell more than 10,000 units (including the models badged in Europe as Citron C-Zero and Peugeot iOn) in February 2011 as officially registered by Guinness World Records. Several months later, the Nissan Leaf, launched in 2010, surpassed the i MiEV as the all-time best selling all-electric car.",Electric Car
"Starting in 2008, a renaissance in electric vehicle manufacturing occurred due to advances in batteries, and the desire to reduce greenhouse gas emissions and improve urban air quality.",Electric Car
"In July 2019, US-based Motor Trend magazine awarded the fully electric Tesla Model S the title ""ultimate car of the year"". In March 2020, the Tesla Model 3 passed the Nissan Leaf to become the world's all-time best-selling electric car, with more than 500,000 units delivered. The Leaf passed the 500,000 unit mark in December 2020.",Electric Car
"In November 2020, GM announced it plans to spend more on electric car development over the next 5 years than it spends on gas and diesel vehicles.",Electric Car
"As of 2020 in the United States, the total cost of ownership of electric cars is less than comparable ICE cars, due to the lower cost of fueling and maintenance, more than making up for the higher initial cost.",Electric Car
"The greater the distance driven per year, the more likely the total cost of ownership for an electric car will be less than for an equivalent ICE car. The break even distance varies by country depending on the taxes, subsidies, and different costs of energy.  In some countries the comparison may vary by city, as a type of car may have different charges to enter different cities; for example, the UK city of London charges ICE cars more than the UK city of Birmingham does.",Electric Car
Several national and local governments have established EV incentives to reduce the purchase price of electric cars and other plug-ins.,Electric Car
"When designing an electric vehicle, manufacturers may find that for low production, converting existing platforms may be cheaper, as development cost is lower; however, for higher production, a dedicated platform may be preferred to optimize design, and cost. As of 2020, the electric vehicle battery is more than a quarter of the total cost of the car. Purchase prices are expected to drop below those of new ICE cars when battery costs fall below US$100 per kWh, which is forecast to be in the mid-2020s.",Electric Car
"Leasing or subscriptions are popular in some countries, depending somewhat on national taxes and subsidies, and end of lease cars are expanding the second hand market.",Electric Car
"According to a study done in 2018, examining only fuel costs, the average fueling cost of an electric vehicle in the United States is $485 per year, as opposed to an ICE cars' $1,117 per year. Estimated gasoline costs varied from $993 in Alabama to $1,509 in Hawaii. Electric costs varied from $372 in Washington to $1,106 in Hawaii.",Electric Car
"The main cost driver of an electric car is its battery. The price decreased from 600 per kWh in 2010, to 170 in 2017, to 100 in 2019.",Electric Car
"Electric cars have several benefits over ICE cars, including a significant reduction of local air pollution, as they do not directly emit pollutants such as volatile organic compounds, hydrocarbons, carbon monoxide, ozone, lead, and various oxides of nitrogen.",Electric Car
"Depending on the production process and the source of the electricity to charge the vehicle, emissions may be partly shifted from cities to the plants that generate electricity and produce the car as well as to the transportation of material. The amount of carbon dioxide emitted depends on the emissions of the electricity source and the efficiency of the vehicle. For electricity from the grid, the emissions vary significantly depending on the region, the availability of renewable sources and the efficiency of the fossil fuel-based generation used. Considering the average electricity mix in the EU, driving electric cars emits 44-56% less greenhouse gas than driving conventional cars. Including the energy intensive production of batteries in the analysis results in 31-46% less greenhouse gas emissions than conventional cars. For context, 94% of EU transport depended on oil in 2017.",Electric Car
"Similar to ICE vehicles, electric cars emit particulates from tyre and brake wear, although regenerative braking in electric cars means less brake dust. The sourcing of fossil fuels (oil well to gasoline tank) causes further damage as well as use of resources during the extraction and refinement processes, including high amounts of electricity.",Electric Car
The cost of installing charging infrastructure has been estimated to be repaid by health cost savings in less than 3 years.,Electric Vehicle
"According to a 2020 study, balancing lithium supply and demand for the rest of the century will require good recycling systems, vehicle-to-grid integration, and lower lithium intensity of transportation.",Electric Car
"Some activists and journalists have raised concerns over the perceived lack of impact of electric cars in solving the climate change crisis compared to other, less popularized methods. These concerns have largely centered around the existence of less carbon-intensive and more efficient forms of transportation such as mass transit and e-scooters and the continuation of a system designed for cars first
 and the potential for carbon lock-in.",Electric Car
"Electric motors can provide high power-to-weight ratios. Batteries can be designed to supply the electrical current needed to support these motors. Electric motors have a flat torque curve down to zero speed. For simplicity and reliability, most electric cars use fixed-ratio gearboxes and have no clutch.",Electric Aircraft
"Many electric cars have faster acceleration than average ICE cars, largely due to reduced drivetrain frictional losses and the more quickly-available torque of an electric motor. However, NEVs may have a low acceleration due to their relatively weak motors.",Electric Car
"Electric vehicles can also use a direct motor-to-wheel configuration that increases the available power. Having motors connected directly to each wheel allows the use of the motor for both propulsion and braking, increasing traction. Electric vehicles that lack an axle, differential, or transmission can have less drivetrain inertia.",Electric Aircraft
"For example, the Venturi Fetish delivers supercar acceleration despite a relatively modest 220kW (300hp) motor and a top speed of around 160km/h (100mph). Some direct current motor-equipped drag racer EVs have simple two-speed manual transmissions to improve top speed. The 2008 Tesla Roadster 2.5 Sport can accelerate from 0 to 97km/h (0 to 60mph) in 3.7seconds with a motor rated at 215kW (288hp). Tesla Model S P100D (Performance / 100kWh / 4-wheel drive) is capable of 2.28 seconds for 060mph at a price of $140,000. As of May2017, the P100D is the second quickest production car ever built, taking only 0.08 seconds longer for 097km/h (060mph), compared to a $847,975 Porsche 918 Spyder. The concept electric supercar Rimac Concept One claims it can go from 097km/h (060mph) in 2.5 seconds. Tesla claims the upcoming Tesla Roadster will go 060mph (097km/h) in 1.9 seconds.",Electric Car
"Internal combustion engines have thermodynamic limits on efficiency, expressed as a fraction of energy used to propel the vehicle compared to energy produced by burning fuel. Gasoline engines effectively use only 15% of the fuel energy content to move the vehicle or to power accessories; diesel engines can reach on-board efficiency of 20%; electric vehicles have efficiencies of 69-72%, when counted against stored chemical energy, or around 59-62%, when counted against required energy to recharge.",Electric Aircraft
"Electric motors are more efficient than internal combustion engines in converting stored energy into driving a vehicle. However, they are not equally efficient at all speeds. To allow for this, some cars with dual electric motors have one electric motor with a gear optimised for city speeds and the second electric motor with a gear optimised for highway speeds. The electronics select the motor that has the best efficiency for the current speed and acceleration. Regenerative braking, which is most common in electric vehicles, can recover as much as one fifth of the energy normally lost during braking.",Electric Car
"While heating can be provided with an electric resistance heater, higher efficiency and integral cooling can be obtained with a reversible heat pump, such as on the Nissan Leaf. PTC junction cooling is also attractive for its simplicity this kind of system is used, for example, in the 2008 Tesla Roadster.",Electric Car
"To avoid using part of the battery's energy for heating and thus reducing the range, some models allow the cabin to be heated while the car is plugged in. For example, the Nissan Leaf, the Mitsubishi i-MiEV, Renault Zoe and Tesla cars can be pre-heated while the vehicle is plugged in.",Electric Car
"Some electric cars (for example, the Citron Berlingo Electrique) use an auxiliary heating system (for example gasoline-fueled units manufactured by Webasto or Eberspcher) but sacrifice ""green"" and ""Zero emissions"" credentials. Cabin cooling can be augmented with solar power external batteries and USB fans or coolers, or by automatically allowing outside air to flow through the car when parked; two models of the 2010 Toyota Prius include this feature as an option.",Electric Aircraft
The safety issues of BEVs are largely dealt with by the international standard ISO 6469. This document is divided into three parts dealing with specific issues:,Electric Vehicle
"Like their ICE counterparts, electric vehicle batteries can catch fire after a crash or mechanical failure. Plug-in electric vehicle fire incidents have occurred, albeit less per distance travelled than ICE vehicles. The first modern crash-related fire was reported in China in May 2012, after a high-speed car crashed into a BYD e6 taxi in Shenzhen.",Electric Car
"In the United States, General Motors ran a training program in several cities for firefighters and first responders to demonstrate how to safely disable the Chevrolet Volt's powertrain and its 12 volt electrical system. The Volt's high-voltage system is designed to shut down automatically in the event of an airbag deployment, and to detect a loss of communication from an airbag control module. GM made available an Emergency Response Guide for the 2011 Volt for use by emergency responders. The guide describes methods of disabling the high voltage system and identifies cut zone information. Nissan also published a guide for first responders that details procedures for handling a damaged 2011 Leaf at the scene of an accident, including a manual high-voltage system shutdown, rather than the automatic process built in the car's safety systems.",Electric Aircraft
"The weight of the batteries themselves usually makes an EV heavier than a comparable gasoline vehicle. In a collision, the occupants of a heavy vehicle will, on average, suffer fewer and less serious injuries than the occupants of a lighter vehicle; therefore, the additional weight brings safety benefits (to the occupant). Depending on where the battery is located, it may lower the center of gravity, increasing driving stability, lowering the risk of an accident through loss of control. An accident will, on average, cause about 50% more injuries to the occupants of a 2,000lb (900kg) vehicle than those in a 3,000lb (1,400kg) vehicle.",Electric Car
"Some electric cars use low rolling resistance tires, which typically offer less grip than normal tires. The Insurance Institute for Highway Safety in America had condemned the use of low speed vehicles and ""mini trucks,"" called NEVs when powered by electric motors, on public roads. Mindful of this, several companies (Tesla Motors, BMW, and Uniti) have succeeded in keeping the body light, while making it very strong.",Electric Aircraft
"As of 2018, most electric cars have similar driving controls to that of a car with a conventional automatic transmission. Even though the motor may be permanently connected to the wheels through a fixed-ratio gear, and no parking pawl may be present, the modes ""P"" and ""N"" are often still provided on the selector. In this case, the motor is disabled in ""N"" and an electrically actuated hand brake provides the ""P"" mode.",Electric Car
"In some cars, the motor will spin slowly to provide a small amount of creep in ""D"", similar to a traditional automatic transmission car.",Electric Car
"When an internal combustion vehicle's accelerator is released, it may slow by engine braking, depending on the type of transmission and mode. EVs are usually equipped with regenerative braking that slows the vehicle and recharges the battery somewhat. Regenerative braking systems also decrease the use of the conventional brakes (similar to engine braking in an ICE vehicle), reducing brake wear and maintenance costs. Usually, formula EVs uses transmission, manual transmission in an electric vehicle helps to control the power being sent.",Electric Aircraft
"Lithium-ion-based batteries are often used for their high power and energy density. Other battery types are cheaper, such as nickel metal hydride (NiMH), but have a poorer power-to-weight ratio than lithium-ion. Batteries with different chemical compositions are in development such as zinc-air battery that could be much lighter.",Electric Aircraft
"The range of an electric car depends on the number and type of batteries used, and (as with all vehicles), the aerodynamics, weight and type of vehicle, performance requirements, and the weather.",Electric Car
The EPA range of production electric vehicles in 2017 ranged from 100km (60 miles) in the Renault Twizy to 540km (340 miles) in the Tesla Model S 100D. Real-world range tests conducted by What Car in early 2019 found that the highest real-world range was 417km (259 miles) in the Hyundai Kona.,Electric Car
"The majority of electric cars are fitted with a display of the expected range. This may take into account how the vehicle is being used and what the battery is powering. However, since factors can vary over the route, the estimate can vary from the actual range. The display allows the driver to make informed choices about driving speed and whether to stop at a charging point en route. Some roadside assistance organizations offer charge trucks to recharge electric cars in case of emergency.",Electric Aircraft
A study in 2016 stated that 87% of US vehicle-days could be met by the then-current affordable electric cars.,Electric Car
"Electric cars are typically charged overnight from a charging station installed in the owner's house, or from faster charging stations found in businesses and public areas.",Electric Car
"Compared to fossil fuel vehicles, the need for charging using public infrastructure is diminished because of the opportunities for home charging; vehicles can be plugged in and begin each day with a full charge, assuming the home charging station can charge quickly enough. An overnight charge of 8 hours using a 120-volt AC outlet will provide around 65km (40 miles) of range, while a 240-volt AC outlet will provide approximately 290km (180 miles).",Electric Car
"Charging an electric vehicle using public charging stations takes longer than refueling a fossil fuel vehicle. The speed at which a vehicle can recharge depends on the charging station's charging speed and the vehicle's own capacity to receive a charge. Connecting a vehicle that can accommodate very fast charging to a charging station with a very high rate of charge can refill the vehicle's battery to 80% in 15 minutes. Vehicles and charging stations with slower charging speeds may take as long as 2 hours to refill a battery to 80%. As with a mobile phone, the final 20% takes longer because the systems slow down to fill the battery safely and avoid damaging it.",Electric Car
Some companies have been experimenting with battery swapping to substantially reduce the effective time to recharge.,Electric Vehicle
"Electric vehicle charging plugs are not yet universal throughout the world. Europe uses the CCS standard, while CHAdeMO is used in Japan, and a GB/T standard is used in China. The United States has no de facto standard, with a mix of CCS, Tesla Superchargers, and CHAdeMO charging stations. However vehicles using one type of plug are generally able to charge at other types of charging stations through the use of plug adapters.",Electric Car
"Some electric cars (for example, the BMW i3) have an optional gasoline range extender. The system is intended as an emergency backup to extend range to the next recharging location, and not for long-distance travel.",Electric Car
"The range-extender option of the BMW i3 was designed to meet the CARB regulation for an auxiliary power unit (APU) called REx. According to rules adopted in March 2012 by CARB, the 2014 BMW i3 with a REx unit fitted was the first car ever to qualify as a range-extended battery-electric vehicle or ""BEVx"".",Electric Aircraft
"As with all lithium-ion batteries, electric vehicle batteries may degrade over long periods of time, especially if they are frequently charged to 100%; however, this may take at least several years before being noticeable.",Electric Car
"Nissan stated in 2015 that at that point only 0.01 percent of batteries had to be replaced because of failures or problems, and then only because of externally inflicted damage. Vehicles that had already covered more than 200,000km (124,274mi) had no problems with the battery.",Electric Vehicle
