Article,Topic
"Volkswagen, in collaboration with six partners, is developing an EU research project that is focused on automating the parking and charging of electric vehicles. The objective of this project is to develop a smart car system that allows for autonomous driving in designated areas (e.g. valet parking, park and ride) and can offer advanced driver support in urban environments. Tesla has shown a prototype of a robot arm that automatically charges their vehicles.",Electric Car
"Experimental supercapacitors and flywheel energy storage devices offer comparable storage capacity, faster charging, and lower volatility. In 2010, they were considered to have the potential to overtake batteries as the preferred rechargeable storage for EVs. The FIA included their use in its sporting regulations of energy systems for Formula One race vehicles in 2007 (for supercapacitors) and 2009 (for flywheel energy storage devices).",Electric Car
"Solar cars are electric vehicles powered completely or significantly by direct solar energy, usually through photovoltaic (PV) cells contained in solar panels that convert the sun's energy directly into electric energy, usually to charge a battery.",Electric Aircraft
"Dynamic charging allows electric vehicles to charge while driving on roads or highways. Sweden is testing four different dynamic charging technologies, three of which are suitable for passenger cars:",Electric Car
"Qualcomm, Hyundai, Ford, and Mitsubishi are the top patent holders of the close to 800 electric vehicle charging patents filed between 2014 and 2017. A majority of patents filed between 2014 and 2017 on electric vehicle charging were filed in Japan, followed by the US and then China.",Electric Car
"Battery electric vehicles are most commonly charged from the power grid overnight at the owner's house. The electricity on the grid is in turn generated from a variety of sources; such as coal, hydroelectricity, nuclear and others. Power sources such as photovoltaic solar cell panels, micro hydro or wind may also be used and are promoted because of concerns regarding global warming.",Electric Aircraft
"Charging stations can have a variety of different speeds of charging, with slower charging being more common for houses, and more powerful charging stations on public roads and areas for trips. The BMW i3 can charge 080% of the battery in under 30 minutes in rapid charging mode. The superchargers developed by Tesla Motors provide up to 250kW of charging, allowing a 250-mile charge in 30 minutes.",Electric Aircraft
"Most electric cars use conductive coupling to supply electricity for recharging after CARB settled on the SAE J1772-2001 standard as the charging interface for electric vehicles in California in June 2001. In Europe, the ACEA has decided to use the Type 2 connector from the range of IEC_62196 plug types for conductive charging of electric vehicles in the European Union, as the Type 1 connector (SAE J1772-2009) does not provide for three-phase charging.",Electric Car
"Another approach is inductive charging using a non-conducting ""paddle"" inserted into a slot in the car. Delco Electronics developed the Magne Charge inductive charging system in 1998 for the General Motors EV1 that was also used for the Chevrolet S-10 EV and Toyota RAV4 EV vehicles.",Electric Car
"During peak load periods, when the cost of generation can be very high, electric vehicles with vehicle-to-grid capabilities could contribute energy to the grid. These vehicles can then be recharged during off-peak hours at cheaper rates while helping to absorb excess night time generation. The batteries in the vehicles serve as a distributed storage system to buffer power.",Electric Aircraft
"According to Bloomberg New Energy Finance, as of December2018, there were almost 180 models of highway-capable all-electric passenger cars and utility vans available for retail sales globally.",Electric Car
"Tesla became the world's leading electric vehicle manufacturer in December 2019, with cumulative global sales of over 900,000 all-electric cars since 2008. Its Model S was the world's top selling plug-in electric car in 2015 and 2016, and its Model 3 has been the world's best selling plug-in electric car for three years in a row, from 2018 to 2020. The Tesla Model 3 surpassed the Leaf in early 2020 to become the world's cumulative best selling electric car, with more than 500,000 sold by March 2020. Tesla produced its 1millionth electric car in March 2020, becoming the first auto manufacturer to do so. Tesla has been listed as the world's top selling plug-in electric car manufacturer, both as a brand and by automotive group for three years running, from 2018 to 2020.",Electric Car
"As of December2019, the RenaultNissanMitsubishi Alliance is one of the world's leading all-electric vehicle manufacturers. Since 2010, the Alliance's global all-electric vehicle sales totaled over 800,000 light-duty electric vehicles through December 2019, including those manufactured by Mitsubishi Motors, now part of the Alliance. Nissan leads global sales within the Alliance, with about 500,000 cars and vans sold by April 2020, followed by the Groupe Renault with more than 273,550 electric vehicles sold worldwide through December 2019, including its Twizy heavy quadricycle. Mitsubishi's only all-electric vehicle is the i-MiEV, with global sales of over 50,000 units by March 2015, accounting for all variants of the i-MiEV, including the two minicab versions sold in Japan. The Alliance's best-selling Nissan Leaf was the world's top-selling plug-in electric car in 2013 and 2014. Through 2019, the Nissan Leaf was the world's all-time top-selling highway-legal electric car with global sales of almost 450,000 units.  The Renault Kangoo Z.E. utility van is the European leader of the light-duty all-electric segment with sales of 57,595 units through November 2020.",Electric Car
"Other leading electric vehicles manufacturers are BAIC Motor, with 480,000 units sold, SAIC Motor with 314,000 units, and Geely with 228,700, all cumulative sales in China as of December2019. BMW is also a leading plug-in car manufacturer, with over 500,000 plug-in electric cars sold globally by December 2019, but its electrified vehicle lineup only includes one all-electric model, the BMW i3, with 200,000 units produced up to October 2020, including the REx variant.",Electric Car
"The following table lists the all-time best-selling highway-capable all-electric cars with cumulative global sales of more than 135,000 units from their inception through December 2020:",Electric Car
Any car can be converted to an electric vehicle using plug-and-play custom solution kits. The car resulting from a conversion of an ICE car to an electric car is called a Retrofitted Electric Vehicle.,Electric Car
"Global sales of highway legal plug-in electric passenger cars and light utility vehicles achieved the one million milestone in September 2015, almost twice as fast as hybrid electric vehicles (HEV). Cumulative global sales of light-duty all-electric vehicles reached one million units in September 2016. Global sales of plug-in passenger cars passed 2million in December 2016, the 3million mark in November 2017, the 5million milestone in December 2018, and totaled 7.2million units in December 2019. Despite rapid growth, the global stock of plug-in electric cars represented about 1 out of every 250 vehicles (0.40%) on the world's roads by the end of 2018.",Electric Car
"As of December2019, the global stock of pure electric passenger cars totaled 4.79million units, representing two-thirds of all plug-in passenger cars on the world's roads. China has the largest all-electric car fleet in use, with 2.58million at the end of 2019, more than half (53.9%) of the worlds electric car stock. In addition, there were almost 378,000 electric light commercial vehicles in use by the end of 2019, mainly in China and Europe.",Electric Car
"All-electric cars have oversold plug-in hybrids for several years, and by the end of 2019, the plug-in market continues to shift towards fully electric battery vehicles. The global ratio between annual sales of battery BEVs and PHEVs went from 56:44 in 2012 to 74:26 in 2019.",Electric Car
"Several national, provincial, and local governments around the world have introduced policies to support the mass-market adoption of plug-in electric vehicles. A variety of policies have been established to provide: financial support to consumers and manufacturers; non-monetary incentives; subsidies for the deployment of charging infrastructure; and long-term regulations with specific targets.",Electric Car
"Financial incentives for consumers are aiming to make electric car purchase price competitive with conventional cars due to the higher upfront cost of electric vehicles. Depending on battery size, there are one-time purchase incentives such as grants and tax credits; exemptions from import duties; exemptions from road tolls and congestion charges; and exemption of registration and annual fees.",Electric Car
"The U.S. offers a federal income tax credit up to US$7,500. The UK offers a Plug-in Car Grant up to GB4,500 (US$5,929). France introduced a bonus-malus CO2-based tax that penalizes fossil-fuel vehicle sales. As of 2020, monetary incentives are available in several European Union member states, China, Norway, some provinces in Canada, South Korea, India, and other countries.",Electric Car
"Among the non-monetary incentives, there are several perks such allowing plug-in vehicles access to bus lanes and high-occupancy vehicle lanes, free parking and free charging. Some countries or cities that restrict private car ownership (for example, a purchase quota system for new vehicles), or have implemented permanent driving restrictions (for example, no-drive days), have these schemes exclude electric vehicles to promote their adoption.",Electric Car
"Some government have also established long term regulatory signals with specific targets such as Zero-emissions vehicle (ZEV) mandates, national or regional CO2 emission regulations, stringent fuel economy standards, and the phase out of internal combustion engine vehicle sales. For example, Norway set a national goal that by 2025 all new car sales should be ZEVs (battery electric or hydrogen).",Electric Car
,Electric Vehicle
,Electric Vehicle
"For the past century, most people have driven ICE cars, making them feel common, familiar, and low risk. Even though EV technology has been around for over a century and modern EVs have been on the market for decades, multiple studies show that various psychological factors impair EV adoption.",Electric Car
"A 2019 study found that the dominant fear hindering EV adoption was range anxiety. ICE car drivers are accustomed to going on trips without having to plan refueling stops, and may worry that an EV will lack the range to reach their destination or the closest charging station. Range anxiety has been shown to diminish among drivers who have gained familiarity and experience with EVs.",Electric Car
"This same study also found that people view driving an EV as an action taken by those with ""stronger attitudes in favor of environmental and energy security"" or by those that are ""attracted to the novelty and status associated with being among the first to adopt new technology"". Thus, people may be resistant to EV ownership if they do not consider themselves environmentalists or early adopters of new technology, or do not want others to think of themselves in this way.",Electric Vehicle
"The perceived value associated with driving an EV can also differ by gender. A 2019 survey conducted in Norway found that people believe women drive EVs for sustainability purposes, while men drive EVs for the new technology. The thought process behind this stereotype is that ""big and expensive cars are driven by men, while women drive smaller, less valuable cars"". Since the reasons behind adopting EVs have a gender component, it can be argued that some fear driving an EV will result in a disconnect between their gender identity and how they are perceived by others.",Electric Car
"An electric aircraft is an aircraft powered by electricity, almost always via one or more electric motors which drive propellers. Electricity may be supplied by a variety of methods, the most common being batteries or solar cells.",Electric Aircraft
"Electrically powered model aircraft have been flown since the 1970s or possibly earlier. They have since developed into unmanned aerial vehicles (UAV) or drones, which in the twenty-first century have become widely used for many purposes.",Electric Aircraft
"Although manned flights in an electrically-powered tethered helicopter go back to 1917 and in airships to the previous century, the first manned free flight by an electrically powered aeroplane, the MB-E1, was not made until October 1973 and most manned electric aircraft today are still only experimental prototypes. Between 2015 and 2016, Solar Impulse 2 completed a circumnavigation of the Earth using solar power. More recently, interest in electric passenger aircraft has grown, for both commercial airliners and personal air vehicles.",Electric Aircraft
Almost all electric aircraft to date have been powered by electric motors driving thrust-generating propellers or lift-generating rotors. Some of the propeller-driven types have been airships.,Electric Aircraft
"CO2 emissions, through their effect on climate change, have recently become a major driving force for the development of electric aircraft, with a zero-emissions electric powertrain being the goal for some development teams. Aviation accounts for 2.4% of all fossil fuel derived CO2 emissions, and its share of the total increased by 32% between 2013 and 2018. Another benefit is the potential for noise reduction, in an industry with a severe noise pollution and abatement problem. Electric motors also do not lose power with altitude, unlike internal-combustion engines, avoiding the need for complex and costly measures used to prevent this, such as the use of turbochargers.",Electric Aircraft
"Mechanisms for storing and supplying the necessary electricity vary considerably, and each has distinct advantages and disadvantages. Mechanisms used include:",Electric Vehicle
"A solar cell converts sunlight directly into electricity, either for direct power or temporary storage. The power output of solar cells is low and requires that many be connected together, which limits their use. Typical solar panels running at 15-20% conversion efficiency (sunlight energy to electrical power) produce about 150200W/m2 (0.0190.025hp/sqft) in direct sunlight. Usable areas are further limited as output from a poorly performing panel impacts the output of all the panels on its circuit, meaning they all require similar conditions, including being at a similar angle to the sun, and not being masked by shadow.",Electric Aircraft
"Between 2010 and 2020, solar power modules have declined in cost by 90% and continue to drop by 13-15% per year. Solar cell efficiency has also risen substantially, from 2% in 1955 to 20% in 1985, and some experimental systems now exceed 44%.",Electric Aircraft
"The free availability of sunlight makes solar power attractive for high-altitude, long-endurance applications, where the cold and reduced atmospheric interference make them significantly more efficient than on the ground. The drop in the dry-air temperature as altitude increases, called the environmental lapse rate (ELR), averages 6.49C/km (memorized in pilot training as  1.98C/1,000ft or 3.56F/1,000feet) so that temperature for a typical airliner's cruising altitude of around 35,000ft (11,000m) will be substantially lower than at ground level.",Electric Aircraft
"Night flying, such for endurance flights and with aircraft providing 24 hour coverage over an area typically require a backup storage system, which is charged during the day from surplus power, and supplies power during the hours of darkness.",Electric Aircraft
"Batteries are the most common onboard energy storage component of electric aircraft, due to their relatively high storage capacity. Batteries first powered airships in the nineteenth century but the lead-acid batteries were very heavy and it was not until the arrival of other chemistries, such as nickel-cadmium (NiCd) later in the twentieth century, that batteries became practical for heavier-than-air aircraft. Modern batteries are mostly rechargeable types based on lithium technologies.",Electric Aircraft
"In 2017 the power available from batteries was estimated at around 170 Wh/kg, 145 Wh/kg at the shaft including the system efficiency, while a gas turbine extracted 6,545 Wh/kg of shaft power from a 11,900 Wh/kg fuel. In 2018 Lithium-ion batteries including packaging and accessories were estimated to give 160 Wh/kg while aviation fuel gave 12,500 Wh/kg.",Electric Aircraft
"The potential of all-electric propulsion remains limited for general aviation, as in 2018 the specific energy of electricity storage was still only 2% of aviation fuel. This 1:50 ratio makes electric propulsion impractical for long-range aircraft, as a 500nmi (930km) mission for an all-electric, 12-passenger aircraft would require a six-fold increase in battery power density.",Electric Aircraft
"As of 2019, the best Li-ion batteries achieved 250-300 Wh/kg, sufficient for a small aircraft, while a regional airliner would have needed a 500 Wh/kg battery pack and an Airbus A320-sized single-aisle would need 2 kWh/kg. Such batteries can reduce the overall operating costs for some short-range flights. For example the 300 kWh battery pack used in the Harbour Air Beavers costs them around $30 Canadian to charge compared to $160 to run the Pratt & Whitney R-985 Wasp Junior petrol engine for one hour, when it burns 91l; 24USgal (20impgal).",Electric Aircraft
"An ultracapacitor is an hybrid electrochemical energy storage system bridging batteries and capacitors, and has some advantages over batteries in being able to charge and discharge much faster with higher peak currents, while not being as limited in the number of charge-discharge cycles, as the reaction is not just chemical but also electrical.",Electric Car
"Their energy density, typically around 5 Wh/kg, is however well below that of batteries, and they are considerably more expensive, even when their longer lifespan is factored in.",Electric Car
"A fuel cell uses the reaction between two chemicals such as hydrogen and oxygen to create electricity, much like a liquid-propellant rocket motor, but generating electricity in a controlled chemical reaction, instead of thrust. While the aircraft must carry the hydrogen (or a similar fuel), with its own complications and risks, the oxygen can be obtained from the atmosphere.",Electric Aircraft
"A Diamond HK36 Super Dimona motor-glider modified by Boeing as a fuel cell demonstrator airplane made piloted test flights in 2008 with a proton exchange membrane (PEM) fuel cell/lithium-ion battery hybrid system, and they have been used in several NASA vehicles including satellites and space capsules, although these must also carry an oxidizer.",Electric Aircraft
"Further research and development work is required before they are competitive in aircraft, as they are more than ten times as expensive as batteries.",Electric Aircraft
"Power beaming of electromagnetic energy such as microwaves relies on a ground-based power source. However, compared to using a power cable, power beaming allows the aircraft to move laterally and carries a much lower weight penalty, particularly as altitude increases. The technology has only been demonstrated on small models and awaits practical development at larger scales.",Electric Aircraft
"For powered vehicles replacing tethered aerostats, an electrical power cable can be connected to a ground-based supply, such as an electric generator or the local power grid. At low altitudes this avoids having to lift batteries, and was used by the experimental Petrczy-Krmn-urovec PKZ-1 observation vehicle of 1917. However the higher it flies, the heavier the length of cable it lifts becomes.",Electric Aircraft
"While the batteries weigh more than the equivalent in fuel, electric motors weigh less than their piston-engine counterparts and in smaller aircraft used for shorter flights, can improve the disparity between electric and gasoline energy densities. The MagniX Magni500 electric motor used in the Harbour Air electric de Havilland Canada Beaver weighs 135kg (297lb) dry and develops 560kW (750shp) compared to the Pratt & Whitney R-985 Wasp Junior with a dry weight of 290kg (640lb), producing 300kW (400bhp) it is replacing.  Other motors being developed, such as at Siemens provide an even better power to weight ratio.",Electric Aircraft
"On the Cessna 208 Caravan, the Pratt & Whitney Canada PT6A-114A outputs 503kW (675shp) and weighs 160kg (360lb) dry.",Electric Vehicle
"Siemens has a 260kW (350hp) electric motor that weighs only 50kg (110lb), specifically designed for aircraft use. The comparable Continental IO-550-A reciprocating engine outputs 220kW (300hp) and has a dry weight of 195.37kg (430.72lb). Besides the motor itself, an electric propulsion system also includes a power inverter and must account for the fuel reserve equivalent, while the gasoline engines have generators, oil coolers, fuel lines, pumps and other equipment that need to be fully factored into any comparison that are not all included in the dry weight.",Electric Aircraft
"Additionally, the increase in power, combined with Supplemental Type Certificate (STC) modifications can offset the weight of the batteries by increasing the airplane's gross operating weights, including crucially, the landing weight. Aircraft that use fossil fuels are lighter when they land, which allows the structure that needs to absorb the impact to be lighter. With a battery powered aircraft, the weight remains the same, and so may require reinforcement.",Electric Aircraft
"A hybrid electric aircraft is an aircraft with a hybrid electric powertrain. It typically takes off and lands under clean and quiet electric power, and cruises under conventional piston or jet engine power. This makes long flights practical, while reducing their carbon footprint.
By May 2018, there were over 30 projects, and short-haul hybrid-electric airliners were envisioned from 2032.
The most advanced are the Zunum Aero 10-seater,  the Airbus E-Fan X demonstrator, the VoltAero Cassio, UTC is modifying a Bombardier Dash 8, while an Ampaire prototype first flew on 6 June 2019.",Electric Aircraft
"In November 2018, MIT engineers achieved the first free flight with a model aircraft having no moving parts, the EAD Airframe Version 2. It is propelled by creating an ion wind using magnetohydrodynamics (MHD). MHD has been used to achieve vertical lift in the past, but only by cabling up the MHD ion generator system to an external power supply.",Electric Aircraft
"The use of electricity for aircraft propulsion was first experimented with during the development of the airship in the latter part of the nineteenth century. On 8 October 1883, Gaston Tissandier flew the first electrically-powered airship.:292 The following year, Charles Renard and Arthur Krebs flew La France with a more powerful motor.:306 Even with the lifting capacity of an airship, the heavy accumulators needed to store the electricity severely limited the speed and range of such early airships.",Electric Aircraft
"For a tethered device such as an air observation platform, it is possible to run the power up the tether. In an attempt to create a more practical solution than the clumsy balloons then in use, the Austro-Hungarian Petrczy-Krmn-urovec PKZ-1 electric-powered helicopter was flown in 1917. It had a specially-designed 190hp (140kW) continuous-rated electric motor made by Austro-Daimler and received its power up a cable from a ground-based DC generator. However electric motors were not yet powerful enough for such applications and the motor burned out after only a few flights.",Electric Aircraft
"In 1909, an electric free flight model was claimed to have been flown eight minutes, but this claim has been disputed by the builder of the first recorded electric Radio-Controlled model aircraft flight in 1957. Power density for electric flight was problematic even for small models.",Electric Aircraft
"In 1964, William C. Brown at Raytheon flew a model helicopter that received all of the power needed for flight by microwave power transmission.",Electric Aircraft
"Success in a full-sized aeroplane would not be achieved until Nickel-cadmium (NiCad) batteries were developed, having a much higher energy storage-to-weight ratio than lead-acid batteries. In 1973, Fred Militky and Heino Brditschka converted a Brditschka HB-3 motor glider to an electric aircraft, the Militky MB-E1. On 21 October, it flew for 14 minutes to become the first electric aircraft to fly under its own power with a person on board.",Electric Aircraft
"Developed almost in parallel with NiCad technology, solar cells were also slowly becoming a practicable power source. Following a successful model test in 1974, the world's first official flight in a solar-powered, person-carrying aircraft took place on April 29, 1979. The Mauro Solar Riser used photovoltaic cells to deliver 350W (0.47hp) at 30 volts. These charged a small battery, which in turn powered the motor. The battery alone was capable of powering the motor for 3 to 5 minutes, following a 1.5-hour charge, enabling it to reach a gliding altitude.",Electric Aircraft
